groupid;url;title;review_id;sentence_id;text;annotation 1;annotation 2;annotation 3;label
4;https://najdoktor.com/dr-stipe-corluka/d18436;Stipe Ćorluka;153;4;To puno govori kakav je čovjek,a prvo izvrstan liječnik.;positive;positive;positive;positive
4;https://najdoktor.com/dr-stipe-corluka/d18436;Stipe Ćorluka;153;5;Svako tko ima problema sa kralježnicom preporučam doktora Ćorluku.;positive;positive;positive;positive
4;https://najdoktor.com/dr-stipe-corluka/d18436;Stipe Ćorluka;153;6;Zahvaljujem i njegovom osoblju,jer uvijek znaju raspoloživi čovjeka.;positive;positive;positive;positive
4;https://najdoktor.com/dr-stipe-corluka/d18436;Stipe Ćorluka;154;1;Strućnjak za kralježnicu ljubazan vratio je meni i obitelji osmjeh na lice vratio me u život;positive;positive;positive;positive
4;https://najdoktor.com/dr-stipe-corluka/d18436;Stipe Ćorluka;154;2;Doktore hvala Vama i cijelom osoblju traumatologije u Draškovičevoj 19;positive;positive;positive;positive
4;https://najdoktor.com/dr-stipe-corluka/d18436;Stipe Ćorluka;155;1;Doktor je veoma ljubazan i stručan!;positive;positive;positive;positive
4;https://najdoktor.com/dr-stipe-corluka/d18436;Stipe Ćorluka;155;2;Njegov pristup vratio mi je vjeru u Hrvatsko zdravstvo, drago mi je da se kao mladi čovjek odlučio ostati u Hrvatskoj raditi svoj poziv!;positive;positive;positive;positive
4;https://najdoktor.com/dr-stipe-corluka/d18436;Stipe Ćorluka;156;1;Pohvaljujem doktora Ćorluku zbog njegove prvenstveno ljudskosti, ljubaznosti, profesionalnosti i ulozenom trudu za rjesavanje mojih zdravstvenih problema te njegovoj brizi za pacijente.;positive;positive;positive;positive
4;https://najdoktor.com/davor-franicevic/d16194;Davor Franičević;157;1;Doktor je bezobrazan, bahat i umišljen.;negative;negative;negative;negative
4;https://najdoktor.com/davor-franicevic/d16194;Davor Franičević;157;2;Pravi se kao da je najpametniji i za njega su žene glupe.;negative;negative;negative;negative
4;https://najdoktor.com/davor-franicevic/d16194;Davor Franičević;157;3;Zanima me koja žena mu plati u privat ambulanti pregled , za takvo bahato ponašanje.;negative;negative;sarcastic;negative
4;https://najdoktor.com/davor-franicevic/d16194;Davor Franičević;157;4;Kasni na posao, nikada ne dolazi na vrijeme, ako tko pita gdje je on se ljuti.;negative;negative;negative;negative
4;https://najdoktor.com/davor-franicevic/d16194;Davor Franičević;157;5;Ne preporučujem, nikako;negative;negative;negative;negative
4;https://najdoktor.com/davor-franicevic/d16194;Davor Franičević;158;1;Doktor je prilično bahat, ne možeš ga ništa pitati.;negative;negative;negative;negative
4;https://najdoktor.com/davor-franicevic/d16194;Davor Franičević;158;2;Jer kod njega pitanja ne postoje .;sarcastic;negative;neutral;negative
4;https://najdoktor.com/davor-franicevic/d16194;Davor Franičević;158;3;Samo kaže što ON želi i točka.;negative;negative;negative;negative
4;https://najdoktor.com/davor-franicevic/d16194;Davor Franičević;158;4;Nebi ga preporučila nikome.;negative;negative;negative;negative
4;https://najdoktor.com/davor-franicevic/d16194;Davor Franičević;158;5;Katastofa od jednog liječnika.;negative;negative;negative;negative
4;https://najdoktor.com/davor-franicevic/d16194;Davor Franičević;159;1;Danas sam prvi put bila kod dr. Franičevića i mogu vam reći da je bio jako pristojan prema meni i sve mi lijepo stručno objasnio.;positive;positive;positive;positive
4;https://najdoktor.com/davor-franicevic/d16194;Davor Franičević;159;2;Nakon 4 godine su mi napokon objašnjene neke stvari koje mi prijašnji doktor nije ni jednom objasnio.;positive;positive;positive;positive
4;https://najdoktor.com/davor-franicevic/d16194;Davor Franičević;159;3;Stvorio je jako ugodnu atmosferu i ni u jednom trenutku mi nije bilo neugodno.;positive;positive;positive;positive
4;https://najdoktor.com/davor-franicevic/d16194;Davor Franičević;159;4;Pričao je sa mnom ko da sam malo dijete i kad sam izašla rekao mi je bok miško.;negative;positive;negative;negative
4;https://najdoktor.com/davor-franicevic/d16194;Davor Franičević;159;5;Lijepo i simpatično.;positive;positive;positive;positive
4;https://najdoktor.com/davor-franicevic/d16194;Davor Franičević;159;6;Shvatila sam da ne voli kad se previše komplicira (npr. kad me pito za posljednju menstruaciju, otprilike sam mu rekla kad je bila i reko je da se upravo tako i odgovara jer on ne treba znati tocan datum, vrijeme).;neutral;neutral;neutral;neutral
4;https://najdoktor.com/davor-franicevic/d16194;Davor Franičević;159;7;Predložio mi je i kontracepcijske pilule zbog prištića koje imam i kad sam mu rekla da se pomalo i bojim piti te tablete i da sam neodlučna rekao mi je da nek lijepo razmislim i dođem na savjetovanje kad odlučim i da ćemo popričat i da postoje i slabije tablete, jer mi je prijašnji doktor dao dijane i nisam ih željela piti, a kad sam ga zamolila da mi da druge rekao je da ne može da moram probati odgovaraju li mi ove.;neutral;neutral;mixed;neutral
4;https://najdoktor.com/davor-franicevic/d16194;Davor Franičević;159;8;Ali kažem dr. Franičević je sve lijepo objasnio i bio je jako ljubazan.;positive;positive;positive;positive
4;https://najdoktor.com/davor-franicevic/d16194;Davor Franičević;159;9;Voli se šalit na svoj način, meni simpatičan.;positive;positive;positive;positive
4;https://najdoktor.com/davor-franicevic/d16194;Davor Franičević;159;10;Za prvi put sam zadovoljna, a kako će biti dalje, vidjet ćemo;positive;positive;positive;positive
4;https://najdoktor.com/davor-franicevic/d16194;Davor Franičević;160;1;Bio je poprilično neugodan i bahat.;negative;negative;negative;negative
4;https://najdoktor.com/davor-franicevic/d16194;Davor Franičević;160;2;Niti na jedno pitanje nisam dobila normalan i pristojan odgovor.;negative;negative;negative;negative
4;https://najdoktor.com/davor-franicevic/d16194;Davor Franičević;160;3;"Čak je izjavio da ga nerviraju ""glupi ljudi"" iz razloga što nisam imala nalaz krvi kod sebe za koji nisam ni znala da je potrebno imati prilikom prvog pregleda, jer me nikad nitko to nije tražio.";negative;negative;negative;negative
4;https://najdoktor.com/davor-franicevic/d16194;Davor Franičević;160;4;Sramotno za jednog doktora i visokoobrazovanog čovjeka.;negative;negative;negative;negative
4;https://najdoktor.com/davor-franicevic/d16194;Davor Franičević;161;1;Upravo sam bila na pregledu kod dr. Franicevica, prvi put, i na putu do doma sam se odlucila registrirati i pohvaliti ga :);negative;positive;positive;positive
4;https://najdoktor.com/davor-franicevic/d16194;Davor Franičević;161;2;odusevljena sam njegovim pristupom i strucnoscu;positive;positive;positive;positive
4;https://najdoktor.com/davor-franicevic/d16194;Davor Franičević;161;3;Napravio je ugodnu atmosferu u kojoj sva neugoda nestaje a moram priznati da se ne sjecam jesam li ikada dobila toliko detaljan, i meni razumljiv, nalaz i cjelokupan pregled!;positive;positive;positive;positive
4;https://najdoktor.com/davor-franicevic/d16194;Davor Franičević;161;4;Samnom je bio jako ljubazan i srdacan.;positive;positive;positive;positive
4;https://najdoktor.com/davor-franicevic/d16194;Davor Franičević;161;5;Za svaku preporuku, 5+;positive;positive;positive;positive
4;https://najdoktor.com/davor-franicevic/d16194;Davor Franičević;162;1;Samo sam dosla bez naruđbe radi hitne situacije i odmah sam bila primljena.;neutral;positive;positive;positive
4;https://najdoktor.com/davor-franicevic/d16194;Davor Franičević;162;2;Malo je kasnio ali bitno da su moji problemi bili rjeseni kroz para dana i nalazi krvi i moji nalazi.;mixed;mixed;mixed;mixed
4;https://najdoktor.com/davor-franicevic/d16194;Davor Franičević;162;3;Stvarno se potrudio brzo rijesiti problem.;positive;positive;positive;positive
4;https://najdoktor.com/davor-franicevic/d16194;Davor Franičević;162;4;To mi je bilo prvi put da idem kod muskog ginekologa ali bila sam u situaciji kada nisam imala vremena za birati.;neutral;neutral;neutral;neutral
4;https://najdoktor.com/davor-franicevic/d16194;Davor Franičević;162;5;Na prvi pogled bila sam zadovoljna i rekla sama sebi da sam dramila previse oko toga sto je musko.;positive;positive;positive;positive
4;https://najdoktor.com/davor-franicevic/d16194;Davor Franičević;162;6;Zna biti i ljudima psihijatar i svu potporu pruziti i napraviti ugodnu atmosferu ali i također zna vam dati do znanja ako nesto pogresno radite i zezate se s necim cim nebi smjeli pa sam mu također i na tome zahvalna.;positive;positive;positive;positive
4;https://najdoktor.com/davor-franicevic/d16194;Davor Franičević;162;7;No kako su ti moji nalazi svakodnevno stizali pa sam par dana za redom dolazila do ambulante te mu je također tada bio zadnji tjedan na borovju prilikom izlaska iz ambulante rekao mi je pusa...;neutral;negative;negative;negative
4;https://najdoktor.com/davor-franicevic/d16194;Davor Franičević;163;1;Odličan doktor, za svaku pohvalu i preporuku.;positive;positive;positive;positive
4;https://najdoktor.com/davor-franicevic/d16194;Davor Franičević;163;2;Vrlo je temeljit, stručan, strpljiv i profesionalan.;positive;positive;positive;positive
4;https://najdoktor.com/davor-franicevic/d16194;Davor Franičević;163;3;Posveti se pacijentu i izdvoji vrijeme da detaljno objasni pozadinu.;positive;positive;positive;positive
4;https://najdoktor.com/davor-franicevic/d16194;Davor Franičević;163;4;Ima vrlo specifičan smisao za humor pa mogu razumjeti da ne odgovara svima.;neutral;neutral;positive;neutral
4;https://najdoktor.com/davor-franicevic/d16194;Davor Franičević;163;5;U svakom slučaju, vrlo pozitivno iskustvo.;positive;positive;positive;positive
4;https://najdoktor.com/davor-franicevic/d16194;Davor Franičević;164;1;Moram reci da sam jako zadovoljna odnosom koji dr. Franicevic ima prema pacijentima i njegovim radom.;positive;positive;positive;positive
4;https://najdoktor.com/davor-franicevic/d16194;Davor Franičević;164;2;Nakon sto sam procitala ocjene i komentare ovdje ocekivala sam tko zna sto... ali onda sam usla u ordinaciju i imala valjda najbolje i najopustenije iskustvos ginekologom u zivotu.;positive;positive;positive;positive
4;https://najdoktor.com/davor-franicevic/d16194;Davor Franičević;164;3;Dr. Franicevic nije bezobrazan i neljubazan nego vi drage moje (neke od vas) ne razumijete sarkazam niti zezanciju.;negative;negative;positive;negative
4;https://najdoktor.com/davor-franicevic/d16194;Davor Franičević;164;4;Na neko moje pitanje odgovorio mi je odgovorom na koji sam prasnula u smijeh i nastavili smo normalno razgovarati.;positive;positive;positive;positive
4;https://najdoktor.com/davor-franicevic/d16194;Davor Franičević;164;5;Nije on neljubazan nego covjek mozda trazi novi nacin kako odgovoriti na ista pitanja kojih svaki dan dobiva na desetke i tako stalno.;neutral;neutral;positive;neutral
4;https://najdoktor.com/davor-franicevic/d16194;Davor Franičević;164;6;Covjek samo ima duha i to je sve.;positive;positive;positive;positive
4;https://najdoktor.com/davor-franicevic/d16194;Davor Franičević;164;7;Dok je radio na Borovju primjetila sam i da je sestra sva zivnula, bila dobro raspolozena jer je on dizao atmosferu u ambulanti.;positive;positive;positive;positive
4;https://najdoktor.com/davor-franicevic/d16194;Davor Franičević;164;8;Pregled je obavio profesionalno, interesirao se za svaki problem i dao konstruktivne savjete, vrlo ljubazno i uz pokoju salu.;positive;positive;positive;positive
4;https://najdoktor.com/davor-franicevic/d16194;Davor Franičević;164;9;Znate vi koliko je rijetko danas sresti doktora koji ce vas jos i nasmijati..i jos u javnom zdravstvu.;positive;positive;positive;positive
4;https://najdoktor.com/davor-franicevic/d16194;Davor Franičević;164;10;Dvaka cast doktoru za njegov rad i duh koji ima, neka ga nikad ne izgubi!;positive;positive;positive;positive
4;https://najdoktor.com/davor-franicevic/d16194;Davor Franičević;165;1;Evo da i ja potvrdim da je stigla nova doktorica, Lara Spalldi Barišić :) Bila sam prije dva dana kod nje na pregledu i moram reći da je odlična!;positive;positive;positive;positive
4;https://najdoktor.com/davor-franicevic/d16194;Davor Franičević;165;2;Pri pregledu je vrlo nježna, na uzv-u pokazuje i objašnjava što je što, a na sva pitanja spremno i ljubazno odgovara, daje sugestije i uspoređuje različite terapije.;positive;positive;positive;positive
4;https://najdoktor.com/davor-franicevic/d16194;Davor Franičević;165;3;U svakom slučaju, preporučila bih ju svakome!;positive;positive;positive;positive
4;https://najdoktor.com/davor-franicevic/d16194;Davor Franičević;166;1;...i tako danas zovem ordinaciju, sestra se javlja odmah, cujem novi glas, odmah mi je Sunce svanulo :-);positive;positive;positive;positive
4;https://najdoktor.com/davor-franicevic/d16194;Davor Franičević;166;2;Cula sam da dolazi nova dr u ordinaciju, pa reko da provjerim, kad ono opet sunce!!!;positive;positive;positive;positive
4;https://najdoktor.com/davor-franicevic/d16194;Davor Franičević;166;3;Nova dr je dosla prije dva tjedna na mjesto dr Franicevica!!;neutral;positive;positive;positive
4;https://najdoktor.com/davor-franicevic/d16194;Davor Franičević;166;4;Dr se zove dr Lara Spalldi Barisic.. Uskoro idem na pregled i nadam se da ce bitt sve ok, a ne iskustvo kakvo ste imale sa dr F. Pozdrav :-);positive;positive;positive;positive
4;https://najdoktor.com/davor-franicevic/d16194;Davor Franičević;167;1;Ja sam nakon 2 susreta s dotičnim uredno potražila novog ginekologa.;negative;negative;negative;negative
4;https://najdoktor.com/davor-franicevic/d16194;Davor Franičević;167;2;Na moje otvoreno pitanje zašto čekam preko 2 sata da me primi mi je izjavio da je ovo socijalna medicina i da ako želim na vrijeme doći na red nek si odem kod privatnika.;negative;negative;negative;negative
4;https://najdoktor.com/davor-franicevic/d16194;Davor Franičević;167;3;To je, uz pridržavanje samo onih smjernica koje mi pašu (čitaj onih uz koje manje radi), ignoriranje mog povišenog TSH, policističnih jajnika, preporuka za obradu danih od strane profesorice na medicinskom fakultetu i komentiranja kako su liječnice opće prakse isfrustrirane Cosmo kokoši je bilo dovoljno da promjenim ginekologa.;negative;negative;negative;negative
4;https://najdoktor.com/davor-franicevic/d16194;Davor Franičević;167;4;Da ne spominjem kako me prilikom prvog ulaska u ambulantu dočekao tako krasan prizor bauštelskog proreza iznad ruba hlača da sam mislila kako krivo vidim!;negative;negative;negative;negative
4;https://najdoktor.com/davor-franicevic/d16194;Davor Franičević;168;1;Čekala sam na pregled 2,5 mjeseca.;neutral;negative;neutral;neutral
4;https://najdoktor.com/davor-franicevic/d16194;Davor Franičević;168;2;Dođem u dogovoreno vrijeme, ali doc. F. nema.;neutral;negative;negative;negative
4;https://najdoktor.com/davor-franicevic/d16194;Davor Franičević;168;3;Vani čeka desetak žena ,neke su i trudnice.;neutral;negative;negative;negative
4;https://najdoktor.com/davor-franicevic/d16194;Davor Franičević;168;4;U jednom trenutku gubim strpljenje i kucam na sestri na vrata.;negative;negative;negative;negative
4;https://najdoktor.com/davor-franicevic/d16194;Davor Franičević;168;5;Jedan put pristojno, pa drugi a ono ništa.;negative;negative;negative;negative
4;https://najdoktor.com/davor-franicevic/d16194;Davor Franičević;168;6;Odgovora nema.;negative;negative;negative;negative
4;https://najdoktor.com/davor-franicevic/d16194;Davor Franičević;168;7;Dok sam dobrano lupila po vratima tada se gospođa odazvala.;negative;negative;negative;negative
4;https://najdoktor.com/davor-franicevic/d16194;Davor Franičević;168;8;Doktora naravno nema ,već je 14 i 30.;negative;negative;negative;negative
4;https://najdoktor.com/davor-franicevic/d16194;Davor Franičević;168;9;Na moje inzistiranje gdje je odgovara u Poliklinici Zagreb.;negative;negative;negative;negative
4;https://najdoktor.com/davor-franicevic/d16194;Davor Franičević;168;10;Eto odgovora gospon zarađuje na dvije strane.;negative;negative;sarcastic;negative
4;https://najdoktor.com/davor-franicevic/d16194;Davor Franičević;168;11;Ode obavit privatno pa onda ako ostane vremena dođe u Borovje.;negative;negative;sarcastic;negative
4;https://najdoktor.com/davor-franicevic/d16194;Davor Franičević;168;12;Traźim novog ginića.;negative;negative;negative;negative
4;https://najdoktor.com/davor-franicevic/d16194;Davor Franičević;169;1;Jedan susret je bio dovoljan da potrazim drugog ginekologa.;negative;negative;negative;negative
4;https://najdoktor.com/davor-franicevic/d16194;Davor Franičević;169;2;Niposto ne bi smio raditi s ljudima.;negative;negative;negative;negative
4;https://najdoktor.com/davor-franicevic/d16194;Davor Franičević;169;3;Sestra, dok je bila doktorica Lenija, je bila ljubazna i nasmijana, spremna izici u susret.;positive;negative;positive;positive
4;https://najdoktor.com/davor-franicevic/d16194;Davor Franičević;169;4;Cula sam da i na nju vice i stekla dojam da ga se boji...;negative;negative;negative;negative
4;https://najdoktor.com/davor-franicevic/d16194;Davor Franičević;169;5;Potpuno je razumijem jer taj covjek zlostavlja verbalno zlostavlja ljude kojima bi trebao pomoci.;negative;negative;negative;negative
4;https://najdoktor.com/davor-franicevic/d16194;Davor Franičević;170;1;A sestru uz tečaj o korištenju naprednih tehnologija kao što je fiksni telefon treba pojasnit da ljudi obično ne čuju kad ih se doziva iza zatvorenih vrata.;negative;negative;negative;negative
4;https://najdoktor.com/davor-franicevic/d16194;Davor Franičević;171;1;Vjerojatno je tako arogantan i bezobrazan uvijek, kao što je danas bio, jer je isfrustriran što ne zna jasno i normalno izgovorit nekoliko jednostavnih rečenica pa zbunjuje sebe i druge pa zbog toga histerizira.;negative;negative;negative;negative
4;https://najdoktor.com/davor-franicevic/d16194;Davor Franičević;171;2;Postoje super logopedi u suvagu za djecu od 3 do 10 godina koji bi mu možda pomogli, ali sumnjam.;sarcastic;sarcastic;sarcastic;sarcastic
4;https://najdoktor.com/davor-franicevic/d16194;Davor Franičević;172;1;Ako mislite da ćete nazvati i očekujete da će se netko javiti na drugoj strani, onda ste naivni.;negative;negative;sarcastic;negative
4;https://najdoktor.com/davor-franicevic/d16194;Davor Franičević;172;2;Sestru je nemoguće dobiti na telefon.;negative;negative;negative;negative
4;https://najdoktor.com/davor-franicevic/d16194;Davor Franičević;172;3;Kad čekate na pregled, u sobi od sestre, telefon stalno zvoni, ali ga ona uopće ne doživljava.;negative;negative;negative;negative
4;https://najdoktor.com/davor-franicevic/d16194;Davor Franičević;172;4;Naručiti se ili dobiti neku informaciju putem telefona, to je kod ove sestre nemoguća misija.;negative;negative;sarcastic;negative
4;https://najdoktor.com/davor-franicevic/d16194;Davor Franičević;172;5;Gospođa ima previše posla, teško joj je raditi.;sarcastic;sarcastic;sarcastic;sarcastic
4;https://najdoktor.com/davor-franicevic/d16194;Davor Franičević;172;6;Trebala bi malo raditi u bolnici da vidi što znači kad medicinske sestre imaju puno posla.;negative;negative;negative;negative
4;https://najdoktor.com/davor-franicevic/d16194;Davor Franičević;172;7;Sram ju može biti, da možemo ocijeniti sestre, ova bi imala najgoru ocjenu.;negative;negative;negative;negative
4;https://najdoktor.com/davor-franicevic/d16194;Davor Franičević;172;8;Ne znam kome to prijaviti?;negative;negative;negative;negative
4;https://najdoktor.com/davor-franicevic/d16194;Davor Franičević;172;9;Definitivno najneugodnija i najneljubaznija medicinska sestra s kojom sam se susrela u zdravstvu.;negative;negative;negative;negative
4;https://najdoktor.com/davor-franicevic/d16194;Davor Franičević;172;10;Sramota.;negative;negative;negative;negative
4;https://najdoktor.com/davor-franicevic/d16194;Davor Franičević;173;1;ja već tjednima pokušavam dobit sestru na telefon, samo da vidim da li se mogu naručit, i ako uspijem, spremna sam i na takvo ponašanje doktora, ako on ima jezik, a bome imam i ja još veći.;negative;negative;negative;negative
4;https://najdoktor.com/davor-franicevic/d16194;Davor Franičević;173;2;a onda ne znam kako će završit.. neću osuđivat dok ne doživim,a onda počinje borba, pa ćemo vidjet dokle će dogurat.;negative;negative;negative;negative
4;https://najdoktor.com/davor-franicevic/d16194;Davor Franičević;174;1;Ili ćemo ga dati u Provjereno, zašto ne.;negative;negative;negative;negative
4;https://najdoktor.com/davor-franicevic/d16194;Davor Franičević;174;2;Najgore je sjediti, šutiti i postrance se jadati.;negative;negative;negative;negative
4;https://najdoktor.com/davor-franicevic/d16194;Davor Franičević;175;1;Čitam sve ove komentare, te komentare o doktoru Franičeviću na drugim forumima i sve su samo ne dobri.;neutral;neutral;negative;neutral
4;https://najdoktor.com/davor-franicevic/d16194;Davor Franičević;175;2;Zanemarimo li to što je sestru apsolutno nemoguće dobiti na telefon, dr. Lenija Pavić je bila izvrsna, i mislim da smo manje više sve bile ekstra zadovoljne njome.;mixed;mixed;mixed;mixed
4;https://najdoktor.com/davor-franicevic/d16194;Davor Franičević;175;3;Razmišljam sada postoji li neka mogućnost da se npr.udružimo i napravimo peticiju za smjenu doktora?;negative;negative;negative;negative
4;https://najdoktor.com/davor-franicevic/d16194;Davor Franičević;175;4;Znam da ne možemo tražiti natrag dr. Leniju, al možemo tražiti novoga doktora.;negative;negative;negative;negative
4;https://najdoktor.com/davor-franicevic/d16194;Davor Franičević;175;5;Ne vidim razloga zašto se to ne bi probalo.;neutral;negative;negative;negative
4;https://najdoktor.com/davor-franicevic/d16194;Davor Franičević;175;6;Jer ostavljanje negativnih komentara ovdje na forumu nam neće previše pomoći da se doktor promijeni.;neutral;negative;negative;negative
4;https://najdoktor.com/davor-franicevic/d16194;Davor Franičević;175;7;Na kraju krajeva, ljudi moji, mi plaćamo toga doktora izdvajanjem doprinosa za zdravstvo.;negative;negative;negative;negative
4;https://najdoktor.com/davor-franicevic/d16194;Davor Franičević;175;8;Ništa to nije besplatno, i da smo mi dobili na poklon.;negative;negative;negative;negative
4;https://najdoktor.com/davor-franicevic/d16194;Davor Franičević;175;9;Svakog mjeseca s naše plaće se izdvaja za zdravstvo.;neutral;negative;neutral;neutral
4;https://najdoktor.com/davor-franicevic/d16194;Davor Franičević;175;10;Njegova plaća ide iz naših doprinosa.;negative;negative;neutral;negative
4;https://najdoktor.com/davor-franicevic/d16194;Davor Franičević;175;11;I apsolutno ne zaslužujemo takvo ponašanje.;negative;negative;negative;negative
4;https://najdoktor.com/davor-franicevic/d16194;Davor Franičević;175;12;Ako nas se dovoljno skupi, ja vjerujem da bi mogli napraviti peticiju.;positive;negative;negative;negative
4;https://najdoktor.com/davor-franicevic/d16194;Davor Franičević;175;13;Ako nas se samo par skupi otkantat će nas, i reći ak niste zadovoljni, pravac HZZO i tražite drugog ginića.;negative;negative;negative;negative
4;https://najdoktor.com/davor-franicevic/d16194;Davor Franičević;175;14;Druga opcija je ići tražiti novog ginekologa.;negative;negative;negative;negative
4;https://najdoktor.com/davor-franicevic/d16194;Davor Franičević;175;15;Ja iskreno ne bi htjela ići iz DZ Borovje iz razloga što je dom recimo novo izgrađen, oprema je nova, ima UZV.....a takva situacija nije u baš puno DZ.;negative;negative;negative;negative
4;https://najdoktor.com/davor-franicevic/d16194;Davor Franičević;175;16;Moj prijedlog je da se probamo udružiti i napraviti peticiju za novoga doktora, neznam putem Facebooka da se okupimo ili tako nešto.;negative;negative;negative;negative
4;https://najdoktor.com/davor-franicevic/d16194;Davor Franičević;175;17;Možda među nama ima i koja pravnica koja bi nam mogla dati savjet...;neutral;negative;negative;negative
4;https://najdoktor.com/davor-franicevic/d16194;Davor Franičević;176;1;Pozdrav svima.. Po komentarima vidim da zene nisu zadovoljne doktorom koji je dosao na mjesto dr Lenije.;neutral;neutral;negative;neutral
4;https://najdoktor.com/davor-franicevic/d16194;Davor Franičević;176;2;Koga u Zg izabratiti od doktorica, koje primaju nove pacijente, jer ozbiljno razmisljam o promjeni doktora.;negative;negative;negative;negative
4;https://najdoktor.com/davor-franicevic/d16194;Davor Franičević;176;3;Hvala;positive;neutral;positive;positive
4;https://najdoktor.com/davor-franicevic/d16194;Davor Franičević;177;1;Doktorica Lenija je bila predivna i velika je steta sto vise ne radi u domu zdravlja Borovje.;mixed;positive;positive;positive
4;https://najdoktor.com/davor-franicevic/d16194;Davor Franičević;177;2;Novi doktor Davor Franicevic je nazalost njezina potpuna suprotnost.;negative;negative;negative;negative
4;https://najdoktor.com/davor-franicevic/d16194;Davor Franičević;177;3;U ordinaciji se pojavio 2 sata nakon pocetka radnog vremena.;negative;negative;negative;negative
4;https://najdoktor.com/davor-franicevic/d16194;Davor Franičević;177;4;Sve narucene pacijentice cekale su nekoliko sati zbog njegova kasnjenja.;negative;negative;negative;negative
4;https://najdoktor.com/davor-franicevic/d16194;Davor Franičević;177;5;Nazalost mozda bi bilo i bolje da uopce nije ni dosao na posao jer je moj pregled kod njega bio moje najgore iskustvo u zivotu.;negative;negative;negative;negative
