groupid;url;title;review_id;sentence_id;text;annotation 1;annotation 2;annotation 3;label
4;https://najdoktor.com/Maja-Jagodi%C4%87-%C5%A0timac,%20dr.med.dent/d10646;Maja Jagodić-Štimac;483;5;2.) kada vam naprave protetiku i dok ste pod anestezijom pitaju da li je sve u redu a vi naravno ne možete osijećati ništa ni u ludilu ne potpisujte 2 obrasca za koje će vam reći da ih potpište odmah i da je to potvrda da ste protetiku koju ste dogovorili i dobili već im recite da želite prvo na miru prije potpisivanja pročitati što piše ( vjerujte, znam o čemu govorim );negative;negative;sarcastic;negative
4;https://najdoktor.com/Maja-Jagodi%C4%87-%C5%A0timac,%20dr.med.dent/d10646;Maja Jagodić-Štimac;483;6;"I najvažnije - nemojte da vam samo zakažu nakon pvog pregleda termin kod nekog svog stomatologa a da vi ni ne znate tko je on / ona i za šta je specijaliziran jer je to vaše pravo kao pacijenta i ako vam se taj dr. ne učini ok. tražite isključivo doktora koji ima titulu specijalista za ono što odlučite raditi a ove koji se ""usavršavaju"" i dodatno ""educiraju"" izbjegnite u širokom luku jer od dr. Maje Jagodić Štimac u slučaju problema pomoć niti povrat novca nećete dobiti mirnim putem";negative;negative;negative;negative
4;https://najdoktor.com/Maja-Jagodi%C4%87-%C5%A0timac,%20dr.med.dent/d10646;Maja Jagodić-Štimac;484;1;Vrhunski doktori i usluga.;positive;positive;positive;positive
4;https://najdoktor.com/Maja-Jagodi%C4%87-%C5%A0timac,%20dr.med.dent/d10646;Maja Jagodić-Štimac;484;2;Zadovoljna sam sa svim uslugama.;positive;positive;positive;positive
4;https://najdoktor.com/Maja-Jagodi%C4%87-%C5%A0timac,%20dr.med.dent/d10646;Maja Jagodić-Štimac;484;3;Od popravaka, vađenja zubi, ugradnje implantanata;positive;positive;positive;positive
4;https://najdoktor.com/Maja-Jagodi%C4%87-%C5%A0timac,%20dr.med.dent/d10646;Maja Jagodić-Štimac;485;1;Liječnica pristupa individualno, maksimalno je posvećena svakom pacijentu.;positive;positive;positive;positive
4;https://najdoktor.com/Maja-Jagodi%C4%87-%C5%A0timac,%20dr.med.dent/d10646;Maja Jagodić-Štimac;485;2;Osjećam se sigurno kada odlazim k njoj, liječnica je stručna i od povjerenja.;positive;positive;positive;positive
4;https://najdoktor.com/Maja-Jagodi%C4%87-%C5%A0timac,%20dr.med.dent/d10646;Maja Jagodić-Štimac;485;3;Draga, ljubazna i suosjećajna sa pacijentom.;positive;positive;positive;positive
4;https://najdoktor.com/Maja-Jagodi%C4%87-%C5%A0timac,%20dr.med.dent/d10646;Maja Jagodić-Štimac;485;4;Nema straha niti boli.;positive;positive;positive;positive
4;https://najdoktor.com/Maja-Jagodi%C4%87-%C5%A0timac,%20dr.med.dent/d10646;Maja Jagodić-Štimac;485;5;Preporučila bih ju prijateljima i rodbini.;positive;positive;positive;positive
4;https://najdoktor.com/Maja-Jagodi%C4%87-%C5%A0timac,%20dr.med.dent/d10646;Maja Jagodić-Štimac;486;1;Jako ljubazno i nadasve profesionalno osoblje.;positive;positive;positive;positive
4;https://najdoktor.com/Maja-Jagodi%C4%87-%C5%A0timac,%20dr.med.dent/d10646;Maja Jagodić-Štimac;486;2;Doktori iznimno ljubazni i profesionalni.;positive;positive;positive;positive
4;https://najdoktor.com/Maja-Jagodi%C4%87-%C5%A0timac,%20dr.med.dent/d10646;Maja Jagodić-Štimac;486;3;Preporucila bi svakom Polikliniku Štimac.;positive;positive;positive;positive
4;https://najdoktor.com/Maja-Jagodi%C4%87-%C5%A0timac,%20dr.med.dent/d10646;Maja Jagodić-Štimac;487;1;Ovdje se radi isključivo o estetici i uzimanju novaca.;negative;negative;negative;negative
4;https://najdoktor.com/Maja-Jagodi%C4%87-%C5%A0timac,%20dr.med.dent/d10646;Maja Jagodić-Štimac;487;2;I ovdje bi titula dr. trebala biti izuzeta ispred imena ove osobe.;negative;negative;negative;negative
4;https://najdoktor.com/Maja-Jagodi%C4%87-%C5%A0timac,%20dr.med.dent/d10646;Maja Jagodić-Štimac;487;3;Meni je ugradila dva implatanta (gdje je bio dovoljan samo jedan)jedan do drugoga izostavljajući dovoljan međuprostor kod zubi(5 i 6) samo da bi uzela novce za dva ugrađena implatanta, Pritom je meni ostavila (zbog svog neznanja i pohlepe) dugogodišnje alergijske reakcije,( jer je konstantno bio prisutan upalni proces u mom tijelu)uništeno povjerenje u svakog doktora, totalnu nemoć i jedan dugi bolni oporavak .;negative;negative;negative;negative
4;https://najdoktor.com/Maja-Jagodi%C4%87-%C5%A0timac,%20dr.med.dent/d10646;Maja Jagodić-Štimac;487;4;Nakon 4 godine tijelo mi je konačno dalo do znanja o čemu je riječ.;negative;neutral;neutral;neutral
4;https://najdoktor.com/Maja-Jagodi%C4%87-%C5%A0timac,%20dr.med.dent/d10646;Maja Jagodić-Štimac;487;5;Tek tada se aktiviralo vrlo bolno zubno meso i zubi odnosno implatanti.;negative;neutral;negative;negative
4;https://najdoktor.com/Maja-Jagodi%C4%87-%C5%A0timac,%20dr.med.dent/d10646;Maja Jagodić-Štimac;487;6;Nakon snimanja dolazi do saznanja da implatanti moraju van.;negative;negative;negative;negative
4;https://najdoktor.com/Maja-Jagodi%C4%87-%C5%A0timac,%20dr.med.dent/d10646;Maja Jagodić-Štimac;487;7;Naručujem se za operativni zahvat kod gospođe Maje Jagodić Štimac i tada smatrajuči da su izvađena oba implatanta odlazim kući.;neutral;neutral;negative;neutral
4;https://najdoktor.com/Maja-Jagodi%C4%87-%C5%A0timac,%20dr.med.dent/d10646;Maja Jagodić-Štimac;487;8;No međutim to se ne događa ,ali to ne saznajem od gospođe. Štimac nego od svog novog stomatologa oralnog kirurga, koji mi za pripremu mosta traži novi rtg snimak.;negative;negative;negative;negative
4;https://najdoktor.com/Maja-Jagodi%C4%87-%C5%A0timac,%20dr.med.dent/d10646;Maja Jagodić-Štimac;487;9;Na slici uviđaju da je još jedan implatant unutra.;neutral;negative;negative;negative
4;https://najdoktor.com/Maja-Jagodi%C4%87-%C5%A0timac,%20dr.med.dent/d10646;Maja Jagodić-Štimac;487;10;Zamislite moj šok !;negative;negative;negative;negative
4;https://najdoktor.com/Maja-Jagodi%C4%87-%C5%A0timac,%20dr.med.dent/d10646;Maja Jagodić-Štimac;487;11;Znači ta žena mi je prije par dana šivala zubno meso govoreći mi: riješeno!;neutral;negative;negative;negative
4;https://najdoktor.com/Maja-Jagodi%C4%87-%C5%A0timac,%20dr.med.dent/d10646;Maja Jagodić-Štimac;487;12;A unutra je ostavila još jedan implatant znajući da mora van.;negative;negative;negative;negative
4;https://najdoktor.com/Maja-Jagodi%C4%87-%C5%A0timac,%20dr.med.dent/d10646;Maja Jagodić-Štimac;487;13;Moj novi doktor smatra da je taj isti postupak vađenja drogog implatanta izostavljen (zbog ne znanja dotične i njenog sina), jer se taj drugi implatant nalazio pre blizu maksilarnih sinusa;negative;negative;negative;negative
4;https://najdoktor.com/Maja-Jagodi%C4%87-%C5%A0timac,%20dr.med.dent/d10646;Maja Jagodić-Štimac;487;14;Ponovno nova operacija, ponovno hrpa antibiotika i anelgetika i ponovno novi izdatak.;negative;negative;negative;negative
4;https://najdoktor.com/Maja-Jagodi%C4%87-%C5%A0timac,%20dr.med.dent/d10646;Maja Jagodić-Štimac;487;15;Teško i bolno iskustvo !;negative;negative;negative;negative
4;https://najdoktor.com/Maja-Jagodi%C4%87-%C5%A0timac,%20dr.med.dent/d10646;Maja Jagodić-Štimac;487;16;Preskočite ovu ordinaciju u velikom luku!;negative;negative;negative;negative
4;https://najdoktor.com/Maja-Jagodi%C4%87-%C5%A0timac,%20dr.med.dent/d10646;Maja Jagodić-Štimac;488;1;Naša obitelj već godinama odlazi u ordinaciju Štimac.;positive;positive;positive;positive
4;https://najdoktor.com/Maja-Jagodi%C4%87-%C5%A0timac,%20dr.med.dent/d10646;Maja Jagodić-Štimac;488;2;Prvo su išli moji roditelji, a danas ja sa svojom djecom.;positive;positive;positive;positive
4;https://najdoktor.com/Maja-Jagodi%C4%87-%C5%A0timac,%20dr.med.dent/d10646;Maja Jagodić-Štimac;488;3;Jako volimo ići kod dr. Štimac zbog profesionalnog pristupa, nove tehnologije koju koristi, ljubaznog osoblja i činjenice da je djeci otklonila strah od zubara.;positive;positive;positive;positive
4;https://najdoktor.com/Maja-Jagodi%C4%87-%C5%A0timac,%20dr.med.dent/d10646;Maja Jagodić-Štimac;488;4;Nadalje, ostajemo vjerni dr. Štimac i nadam se da će moja djeca nastaviti tradiciju.;positive;positive;positive;positive
4;https://najdoktor.com/Maja-Jagodi%C4%87-%C5%A0timac,%20dr.med.dent/d10646;Maja Jagodić-Štimac;489;1;Moje iskustvo s dr. Majom Jagodić-Štimac bilo je iznimno srdačno i pristupačno.;positive;positive;positive;positive
4;https://najdoktor.com/Maja-Jagodi%C4%87-%C5%A0timac,%20dr.med.dent/d10646;Maja Jagodić-Štimac;489;2;Na prvom pregledu me baš ljubazno dočekala i potpuno mi se posvetila, kao da sam joj jedina pacijentica.;positive;positive;positive;positive
4;https://najdoktor.com/Maja-Jagodi%C4%87-%C5%A0timac,%20dr.med.dent/d10646;Maja Jagodić-Štimac;489;3;Detaljno mi je objasnila sve procedure koje trebam napraviti i napokon sada imam tim stručnjaka u Štimac centru kojima potpuno vjerujem.;positive;positive;positive;positive
4;https://najdoktor.com/Maja-Jagodi%C4%87-%C5%A0timac,%20dr.med.dent/d10646;Maja Jagodić-Štimac;489;4;A to mi daje veliki mir.;positive;positive;positive;positive
4;https://najdoktor.com/Maja-Jagodi%C4%87-%C5%A0timac,%20dr.med.dent/d10646;Maja Jagodić-Štimac;489;5;Hvala doktorici i svima u centru na brizi i profesionalnosti, sve preporuke!;positive;positive;positive;positive
4;https://najdoktor.com/Maja-Jagodi%C4%87-%C5%A0timac,%20dr.med.dent/d10646;Maja Jagodić-Štimac;490;1;Imao sam nedavno pregled kod doktorice i oduševljen sam njenim pristupom.;positive;positive;positive;positive
4;https://najdoktor.com/Maja-Jagodi%C4%87-%C5%A0timac,%20dr.med.dent/d10646;Maja Jagodić-Štimac;490;2;Strpljivo je objasnila sve detalje pregleda i odgovorila na sva moja pitanja kao da sam joj jedini pacijent.;positive;positive;positive;positive
4;https://najdoktor.com/Maja-Jagodi%C4%87-%C5%A0timac,%20dr.med.dent/d10646;Maja Jagodić-Štimac;490;3;I nisam znao da se na pregledu radi ortopan pa me to isto ugodno iznenadilo.;positive;positive;positive;positive
4;https://najdoktor.com/Maja-Jagodi%C4%87-%C5%A0timac,%20dr.med.dent/d10646;Maja Jagodić-Štimac;490;4;Hvala doktorici i asistentici na profesionalnosti i pažljivosti, sve preporuke.;positive;positive;positive;positive
4;https://najdoktor.com/Maja-Jagodi%C4%87-%C5%A0timac,%20dr.med.dent/d10646;Maja Jagodić-Štimac;491;1;Došla sam kod doktorice Štimac na prvi pregled a konkretno su me zanimali implantati jer su mi nedostajala tri zuba u donjoj čeljusti.;neutral;neutral;positive;neutral
4;https://najdoktor.com/Maja-Jagodi%C4%87-%C5%A0timac,%20dr.med.dent/d10646;Maja Jagodić-Štimac;491;2;Još sam nekoliko njih morala popraviti.;neutral;neutral;neutral;neutral
4;https://najdoktor.com/Maja-Jagodi%C4%87-%C5%A0timac,%20dr.med.dent/d10646;Maja Jagodić-Štimac;491;3;Doktorica je užasno brižna i pristupačna i sve objasni na pregledu, baš sve do najsitnijih detalja.;positive;positive;positive;positive
4;https://najdoktor.com/Maja-Jagodi%C4%87-%C5%A0timac,%20dr.med.dent/d10646;Maja Jagodić-Štimac;491;4;Baš mi se posvetila, a kasnije me prepustila u ruke ostalim stručnjacima u Štimcu koji su brzo i bezbolno sve sredili.;positive;positive;positive;positive
4;https://najdoktor.com/Maja-Jagodi%C4%87-%C5%A0timac,%20dr.med.dent/d10646;Maja Jagodić-Štimac;491;5;Pohvale i preporuke!;positive;positive;positive;positive
4;https://najdoktor.com/Maja-Jagodi%C4%87-%C5%A0timac,%20dr.med.dent/d10646;Maja Jagodić-Štimac;492;1;Brza i kvalitetna usluga svih zaposlenika, svi su jako ljubazni i susretljivi.;positive;positive;positive;positive
4;https://najdoktor.com/Maja-Jagodi%C4%87-%C5%A0timac,%20dr.med.dent/d10646;Maja Jagodić-Štimac;492;2;Doktori stručni i spremni objasniti postupke.;positive;positive;positive;positive
4;https://najdoktor.com/Maja-Jagodi%C4%87-%C5%A0timac,%20dr.med.dent/d10646;Maja Jagodić-Štimac;493;1;Došla sam kod doktorice Maje po preporuci i prijatelja i supruga i nisam požalila.;positive;positive;positive;positive
4;https://najdoktor.com/Maja-Jagodi%C4%87-%C5%A0timac,%20dr.med.dent/d10646;Maja Jagodić-Štimac;493;2;Ne znam postoji li tko stručniji, godinama već pokušavam riješiti probleme sa zubima i svi govore okvirno, rješavaju male probleme i onda dođem kod ove gospođe doktorice i sve mi objasni u pet minuta i potrudi se i nađe mi trajno rješenje mojih problema!!!;mixed;positive;positive;positive
4;https://najdoktor.com/Maja-Jagodi%C4%87-%C5%A0timac,%20dr.med.dent/d10646;Maja Jagodić-Štimac;493;3;Sasluša me i imam osjećaj kao da je pola problema riješeno samo time što sam došla u ordinaciju.;positive;positive;positive;positive
4;https://najdoktor.com/Maja-Jagodi%C4%87-%C5%A0timac,%20dr.med.dent/d10646;Maja Jagodić-Štimac;493;4;Nastavljam sve raditi u tom centru...;positive;positive;positive;positive
4;https://najdoktor.com/Maja-Jagodi%C4%87-%C5%A0timac,%20dr.med.dent/d10646;Maja Jagodić-Štimac;494;1;Doktorica Maja sve je što jedan doktor treba biti :) i strpljiva i stručna, jako profesionalna, i simpatična...;positive;positive;positive;positive
4;https://najdoktor.com/Maja-Jagodi%C4%87-%C5%A0timac,%20dr.med.dent/d10646;Maja Jagodić-Štimac;494;2;Zbog njezinog pristupa na pregledu sam se odlučila raditi zube u Štimac centru.;positive;positive;positive;positive
4;https://najdoktor.com/Maja-Jagodi%C4%87-%C5%A0timac,%20dr.med.dent/d10646;Maja Jagodić-Štimac;494;3;Nekako mi je unijela sigurnost i maknula sve strahove od velikih radova koji su ispred mene!;positive;positive;positive;positive
4;https://najdoktor.com/Maja-Jagodi%C4%87-%C5%A0timac,%20dr.med.dent/d10646;Maja Jagodić-Štimac;495;1;Imala sam velike probleme sa zubima godinama.;neutral;neutral;neutral;neutral
4;https://najdoktor.com/Maja-Jagodi%C4%87-%C5%A0timac,%20dr.med.dent/d10646;Maja Jagodić-Štimac;495;2;Hodala sam od stručnjaka do stručnjaka ne bi li mi rekli koje je najbolje rješenje za moje zube.;neutral;neutral;neutral;neutral
4;https://najdoktor.com/Maja-Jagodi%C4%87-%C5%A0timac,%20dr.med.dent/d10646;Maja Jagodić-Štimac;495;3;Neki su boljeli, neki su bili osjetljivi, dva sam izgubila prije nekoliko godina... Uglavnom, kad sam s već snimljenim ortopanom došla kod doktorice Maje već je na prvi pogled znala kako i što trebamo napraviti.;positive;positive;mixed;positive
4;https://najdoktor.com/Maja-Jagodi%C4%87-%C5%A0timac,%20dr.med.dent/d10646;Maja Jagodić-Štimac;495;4;Molila sam ju samo da ne bude ništa bolno, a ona mi je objasnila sve tretmane korak po korak kako će se raditi.;positive;positive;positive;positive
4;https://najdoktor.com/Maja-Jagodi%C4%87-%C5%A0timac,%20dr.med.dent/d10646;Maja Jagodić-Štimac;495;5;Jedina stručnjakinja kojoj vjerujem!;positive;positive;positive;positive
4;https://najdoktor.com/Maja-Jagodi%C4%87-%C5%A0timac,%20dr.med.dent/d10646;Maja Jagodić-Štimac;496;1;Nije ni čudo da su mi ju mnogi preporučili!;positive;positive;positive;positive
4;https://najdoktor.com/Maja-Jagodi%C4%87-%C5%A0timac,%20dr.med.dent/d10646;Maja Jagodić-Štimac;496;2;Doktorica Maja sve mi je u kratom roku rekla što trebam napraviti da me ne bole zubi i da imam ljepši osmijeh!;positive;positive;positive;positive
4;https://najdoktor.com/Maja-Jagodi%C4%87-%C5%A0timac,%20dr.med.dent/d10646;Maja Jagodić-Štimac;496;3;Jedva čekam nastaviti radove u Štimac centru;positive;positive;positive;positive
4;https://najdoktor.com/Maja-Jagodi%C4%87-%C5%A0timac,%20dr.med.dent/d10646;Maja Jagodić-Štimac;497;1;Vrhunska usluga, stručnost i ljubaznost cijelog tima na čelu s dr. Majom Štimac je zaista za svaku pohvalu.;positive;positive;positive;positive
4;https://najdoktor.com/Maja-Jagodi%C4%87-%C5%A0timac,%20dr.med.dent/d10646;Maja Jagodić-Štimac;497;2;Vrlo sam zadovoljan pruženom uslugom i finalnim rezultatom stomatološke intervencije.;positive;positive;positive;positive
4;https://najdoktor.com/Maja-Jagodi%C4%87-%C5%A0timac,%20dr.med.dent/d10646;Maja Jagodić-Štimac;498;1;Svake pohvale doktorici!;positive;positive;positive;positive
4;https://najdoktor.com/Maja-Jagodi%C4%87-%C5%A0timac,%20dr.med.dent/d10646;Maja Jagodić-Štimac;498;2;Otišla sam na prvi pregled u strahu, a iz ordinacije izašla bez njega!;positive;positive;positive;positive
4;https://najdoktor.com/Maja-Jagodi%C4%87-%C5%A0timac,%20dr.med.dent/d10646;Maja Jagodić-Štimac;498;3;Jedva čekam popraviti sve što treba i što smo se dogovorile…;positive;positive;positive;positive
4;https://najdoktor.com/Maja-Jagodi%C4%87-%C5%A0timac,%20dr.med.dent/d10646;Maja Jagodić-Štimac;498;4;Jako je bila pažljivam pristupačna i baš mi se posvetila.;positive;positive;positive;positive
4;https://najdoktor.com/Maja-Jagodi%C4%87-%C5%A0timac,%20dr.med.dent/d10646;Maja Jagodić-Štimac;498;5;Za svaku pohvalu!;positive;positive;positive;positive
4;https://najdoktor.com/Maja-Jagodi%C4%87-%C5%A0timac,%20dr.med.dent/d10646;Maja Jagodić-Štimac;500;1;Prezadovoljna sam sa pruženom uslugom.;positive;positive;positive;positive
4;https://najdoktor.com/Maja-Jagodi%C4%87-%C5%A0timac,%20dr.med.dent/d10646;Maja Jagodić-Štimac;500;2;Strucni,ljubazni i brzi, puno hvala i dodem sigurno ponovno...;positive;positive;positive;positive
4;https://najdoktor.com/Maja-Jagodi%C4%87-%C5%A0timac,%20dr.med.dent/d10646;Maja Jagodić-Štimac;501;1;Svaka čast na usluzi ...;positive;positive;positive;positive
4;https://najdoktor.com/Maja-Jagodi%C4%87-%C5%A0timac,%20dr.med.dent/d10646;Maja Jagodić-Štimac;501;2;profesionalizam na vrhuncu!!;positive;positive;positive;positive
4;https://najdoktor.com/Maja-Jagodi%C4%87-%C5%A0timac,%20dr.med.dent/d10646;Maja Jagodić-Štimac;501;3;Doktorica mi je sve lijepo objasnila i ništa me nije bolilo, svake pohvale!;positive;positive;positive;positive
4;https://najdoktor.com/Maja-Jagodi%C4%87-%C5%A0timac,%20dr.med.dent/d10646;Maja Jagodić-Štimac;502;1;Jako stručni, ljubazni, korektni sve najbolje.;positive;positive;positive;positive
4;https://najdoktor.com/Maja-Jagodi%C4%87-%C5%A0timac,%20dr.med.dent/d10646;Maja Jagodić-Štimac;502;2;Doktorice su za svaku pohvalu, kao i svo osoblje.;positive;positive;positive;positive
4;https://najdoktor.com/Maja-Jagodi%C4%87-%C5%A0timac,%20dr.med.dent/d10646;Maja Jagodić-Štimac;502;3;Toplo preporucujem svakome!;positive;positive;positive;positive
4;https://najdoktor.com/Maja-Jagodi%C4%87-%C5%A0timac,%20dr.med.dent/d10646;Maja Jagodić-Štimac;503;1;Sjajna žena, uvijek posluša pacijenta i detaljno sve objasni.;positive;positive;positive;positive
4;https://najdoktor.com/Maja-Jagodi%C4%87-%C5%A0timac,%20dr.med.dent/d10646;Maja Jagodić-Štimac;503;2;Već i sam njezin osmijeh, komunikativnost, srdačan pozdrav svima koji su u čekaoni puno znače.;positive;positive;positive;positive
4;https://najdoktor.com/Maja-Jagodi%C4%87-%C5%A0timac,%20dr.med.dent/d10646;Maja Jagodić-Štimac;503;3;Odmjerena, ljubazna i vrlo profesionalna.;positive;positive;positive;positive
4;https://najdoktor.com/Maja-Jagodi%C4%87-%C5%A0timac,%20dr.med.dent/d10646;Maja Jagodić-Štimac;504;1;Super zadovoljan.;positive;positive;positive;positive
4;https://najdoktor.com/Maja-Jagodi%C4%87-%C5%A0timac,%20dr.med.dent/d10646;Maja Jagodić-Štimac;504;2;Stručno osoblje i sve se da dogovoriti po želji.;positive;positive;positive;positive
4;https://najdoktor.com/Maja-Jagodi%C4%87-%C5%A0timac,%20dr.med.dent/d10646;Maja Jagodić-Štimac;504;3;Toplo preporučujem svakom tko ima bilo kakve stomatološke zahtjeve.;positive;positive;positive;positive
4;https://najdoktor.com/Maja-Jagodi%C4%87-%C5%A0timac,%20dr.med.dent/d10646;Maja Jagodić-Štimac;505;1;Bila sam samo na pregledu kod dr. Maje i moram reći da mi je razbila sve predrasude koje sam imala vezano za privatne zubare.;positive;positive;positive;positive
4;https://najdoktor.com/Maja-Jagodi%C4%87-%C5%A0timac,%20dr.med.dent/d10646;Maja Jagodić-Štimac;505;2;Nije mi ponudila ništa što mi ne treba i čak smo napravili plan kako ćemo sve postepeno rješavati.;positive;positive;positive;positive
4;https://najdoktor.com/Maja-Jagodi%C4%87-%C5%A0timac,%20dr.med.dent/d10646;Maja Jagodić-Štimac;505;3;Nemam nekih velikih problema, ali mi je bitno zbog novaca da sve ide polako i da nemam odjednom velikih troškova.;neutral;positive;neutral;neutral
4;https://najdoktor.com/Maja-Jagodi%C4%87-%C5%A0timac,%20dr.med.dent/d10646;Maja Jagodić-Štimac;505;4;Sve su prilagodili mom rasporedu i dr. Maja je prepuna razumijevanja i što se tiče straha, novaca i mojih želja.;positive;positive;positive;positive
4;https://najdoktor.com/Maja-Jagodi%C4%87-%C5%A0timac,%20dr.med.dent/d10646;Maja Jagodić-Štimac;505;5;Savršeno iskustvo posjete zubaru!;positive;positive;positive;positive
4;https://najdoktor.com/Maja-Jagodi%C4%87-%C5%A0timac,%20dr.med.dent/d10646;Maja Jagodić-Štimac;505;6;Moja preporuka svima!;positive;positive;positive;positive
4;https://najdoktor.com/Maja-Jagodi%C4%87-%C5%A0timac,%20dr.med.dent/d10646;Maja Jagodić-Štimac;506;1;Stručan tim i ljubazno osoblje.;positive;positive;positive;positive
4;https://najdoktor.com/Maja-Jagodi%C4%87-%C5%A0timac,%20dr.med.dent/d10646;Maja Jagodić-Štimac;506;2;Iznimno sam zadovoljna ishodom odrađenog te pristupom liječnice.;positive;positive;positive;positive
4;https://najdoktor.com/Maja-Jagodi%C4%87-%C5%A0timac,%20dr.med.dent/d10646;Maja Jagodić-Štimac;506;3;Svaka pohvala!;positive;positive;positive;positive
4;https://najdoktor.com/Maja-Jagodi%C4%87-%C5%A0timac,%20dr.med.dent/d10646;Maja Jagodić-Štimac;507;1;Kod doktorice sam bio na prvom pregledu i dogovoru za daljnje radove.;positive;neutral;positive;positive
4;https://najdoktor.com/Maja-Jagodi%C4%87-%C5%A0timac,%20dr.med.dent/d10646;Maja Jagodić-Štimac;507;2;Dogovorili smo se za keramičke mostove, gore i dolje.;neutral;neutral;positive;neutral
4;https://najdoktor.com/Maja-Jagodi%C4%87-%C5%A0timac,%20dr.med.dent/d10646;Maja Jagodić-Štimac;507;3;Sve je bilo gotovo u nekih dva tjedna, što mi je super jer sam mislio da ću čekati dulje.;positive;positive;positive;positive
4;https://najdoktor.com/Maja-Jagodi%C4%87-%C5%A0timac,%20dr.med.dent/d10646;Maja Jagodić-Štimac;507;4;To bi mi bilo nezgodno jer ne živim u Hrvatskoj.;neutral;neutral;negative;neutral
4;https://najdoktor.com/Maja-Jagodi%C4%87-%C5%A0timac,%20dr.med.dent/d10646;Maja Jagodić-Štimac;507;5;S novim zubima sam zadovoljan, izgledaju kao moji pravi i super drže, ni ne osjetim ih.;positive;positive;positive;positive
4;https://najdoktor.com/Maja-Jagodi%C4%87-%C5%A0timac,%20dr.med.dent/d10646;Maja Jagodić-Štimac;507;6;Doktorica je isto za svaku pohvalu, sve je ona meni ko laiku objasnila što i zašto i napravila je stvarno super posao.;positive;positive;positive;positive
4;https://najdoktor.com/Maja-Jagodi%C4%87-%C5%A0timac,%20dr.med.dent/d10646;Maja Jagodić-Štimac;508;1;Svaka čast i duboko poštovanje njenom predanom i nadasve stručnom radu.;positive;positive;positive;positive
4;https://najdoktor.com/Maja-Jagodi%C4%87-%C5%A0timac,%20dr.med.dent/d10646;Maja Jagodić-Štimac;508;2;U poliklinici sam napravio nekoliko popravaka zubiju te jedan veći operativni zahvat i mogu reći da sam jednostavno prezadovoljan i s užitkom ću se vraćati u polikliniku.;positive;positive;positive;positive
4;https://najdoktor.com/Maja-Jagodi%C4%87-%C5%A0timac,%20dr.med.dent/d10646;Maja Jagodić-Štimac;509;1;Dugogodišnji sam pacijent u Štimac centru dentalne medicine i stoga se smatram dovoljno kompetentnom da dam svoje mišljenje i o doktorici i o samom centru.;positive;positive;positive;positive
4;https://najdoktor.com/Maja-Jagodi%C4%87-%C5%A0timac,%20dr.med.dent/d10646;Maja Jagodić-Štimac;509;2;Sasvim sam slučajno otišla kod njih prvi put jer su mi bili u blizini i nisam ni jednog trenutka zažalila zbog te odluke.;positive;positive;positive;positive
4;https://najdoktor.com/Maja-Jagodi%C4%87-%C5%A0timac,%20dr.med.dent/d10646;Maja Jagodić-Štimac;509;3;Svaki put kada je bio potreban neki značajniji zahvat, dr. Štimac se osobno potrudila biti na prvom pregledu i dati svoje mišljenje i prijedloge.;positive;positive;positive;positive
4;https://najdoktor.com/Maja-Jagodi%C4%87-%C5%A0timac,%20dr.med.dent/d10646;Maja Jagodić-Štimac;509;4;Sve moje zahvate su radili drugi liječnici na izuzetan i profesionalan način i do sada nisam imala niti jedan put priliku potužiti se na bilo što.;positive;positive;positive;positive
4;https://najdoktor.com/Maja-Jagodi%C4%87-%C5%A0timac,%20dr.med.dent/d10646;Maja Jagodić-Štimac;509;5;Centar je besprijekorno čist, osoblje više nego ljubazno i susretljivo tako da se svaki pacijent može osjećati opušteno i ugodno.;positive;positive;positive;positive
4;https://najdoktor.com/Maja-Jagodi%C4%87-%C5%A0timac,%20dr.med.dent/d10646;Maja Jagodić-Štimac;509;6;Takvu razinu ljubaznosti, razumijevanja, strpljenja i profesionalizma nisam sigurna da možete naći na drugom mjestu.;positive;positive;positive;positive
4;https://najdoktor.com/Maja-Jagodi%C4%87-%C5%A0timac,%20dr.med.dent/d10646;Maja Jagodić-Štimac;510;1;Doktorica zaslužuje svaku pohvalu.;positive;positive;positive;positive
4;https://najdoktor.com/Maja-Jagodi%C4%87-%C5%A0timac,%20dr.med.dent/d10646;Maja Jagodić-Štimac;510;2;Javila sam se mailom na centar, lijepo u detalje su mi objasnili sve što me zanimalo.;positive;positive;positive;positive
4;https://najdoktor.com/Maja-Jagodi%C4%87-%C5%A0timac,%20dr.med.dent/d10646;Maja Jagodić-Štimac;510;3;Zbog toga sam i došla na kraju kod doktorice u Štimac centar i napravila krunice na prednjim zubima.;positive;positive;positive;positive
4;https://najdoktor.com/Maja-Jagodi%C4%87-%C5%A0timac,%20dr.med.dent/d10646;Maja Jagodić-Štimac;510;4;Bojim se zubara pa me inicijalno jako bilo strah uopće doći na pregled, ali doktorica je bila jako ugodna i strpljiva sa mnom, nisam se bojala zubara kao inače.;positive;positive;positive;positive
4;https://najdoktor.com/Maja-Jagodi%C4%87-%C5%A0timac,%20dr.med.dent/d10646;Maja Jagodić-Štimac;511;1;U ogledalu sebe ne mogu prepoznati.;positive;positive;positive;positive
